{
    "version":  1,
    "generated_at":  "2026-10-08",
    "source":  "GeoNames",
    "license":  "CC BY 4.0",
    "attribution_url":  "https://www.geonames.org/",
    "cities":  [
                   {
                       "id":  "dubai",
                       "name_ar":  "ط¯ط¨ظٹ",
                       "name_en":  "Dubai",
                       "country_ar":  "ط§ظ„ط¥ظ…ط§ط±ط§طھ ط§ظ„ط¹ط±ط¨ظٹط© ط§ظ„ظ…طھط­ط¯ط©",
                       "country_en":  "United Arab Emirates",
                       "country_code":  "AE",
                       "lat":  25.07725,
                       "lng":  55.30927,
                       "timezone":  "Asia/Dubai",
                       "elevation":  null
                   },
                   {
                       "id":  "sharjah",
                       "name_ar":  "الشارقة",
                       "name_en":  "Sharjah",
                       "country_ar":  "ط§ظ„ط¥ظ…ط§ط±ط§طھ ط§ظ„ط¹ط±ط¨ظٹط© ط§ظ„ظ…طھط­ط¯ط©",
                       "country_en":  "United Arab Emirates",
                       "country_code":  "AE",
                       "lat":  25.3342,
                       "lng":  55.41221,
                       "timezone":  "Asia/Dubai",
                       "elevation":  null
                   },
                   {
                       "id":  "abu-dhabi",
                       "name_ar":  "ط£ط¨ظˆط¸ط¨ظٹ",
                       "name_en":  "Abu Dhabi",
                       "country_ar":  "ط§ظ„ط¥ظ…ط§ط±ط§طھ ط§ظ„ط¹ط±ط¨ظٹط© ط§ظ„ظ…طھط­ط¯ط©",
                       "country_en":  "United Arab Emirates",
                       "country_code":  "AE",
                       "lat":  24.45118,
                       "lng":  54.39696,
                       "timezone":  "Asia/Dubai",
                       "elevation":  null
                   },
                   {
                       "id":  "mazar-e-sharif",
                       "name_ar":  "ظ…ط²ط§ط± ط´ط±ظٹظپ",
                       "name_en":  "Mazar-e Sharif",
                       "country_ar":  "ط£ظپط؛ط§ظ†ط³طھط§ظ†",
                       "country_en":  "Afghanistan",
                       "country_code":  "AF",
                       "lat":  36.70904,
                       "lng":  67.11087,
                       "timezone":  "Asia/Kabul",
                       "elevation":  null
                   },
                   {
                       "id":  "kabul",
                       "name_ar":  "ظƒط§ط¨ظ„",
                       "name_en":  "Kabul",
                       "country_ar":  "ط£ظپط؛ط§ظ†ط³طھط§ظ†",
                       "country_en":  "Afghanistan",
                       "country_code":  "AF",
                       "lat":  34.52813,
                       "lng":  69.17233,
                       "timezone":  "Asia/Kabul",
                       "elevation":  null
                   },
                   {
                       "id":  "herat",
                       "name_ar":  "ظ‡ط±ط§ط©",
                       "name_en":  "Herat",
                       "country_ar":  "ط£ظپط؛ط§ظ†ط³طھط§ظ†",
                       "country_en":  "Afghanistan",
                       "country_code":  "AF",
                       "lat":  34.34817,
                       "lng":  62.19967,
                       "timezone":  "Asia/Kabul",
                       "elevation":  null
                   },
                   {
                       "id":  "buenos-aires",
                       "name_ar":  "ط¨ظˆظٹظ†ط³ ط¢ظٹط±ط³",
                       "name_en":  "Buenos Aires",
                       "country_ar":  "ط§ظ„ط£ط±ط¬ظ†طھظٹظ†",
                       "country_en":  "Argentina",
                       "country_code":  "AR",
                       "lat":  -34.61315,
                       "lng":  -58.37723,
                       "timezone":  "America/Argentina/Buenos_Aires",
                       "elevation":  null
                   },
                   {
                       "id":  "vienna",
                       "name_ar":  "ظپظٹظٹظ†ط§",
                       "name_en":  "Vienna",
                       "country_ar":  "ط§ظ„ظ†ظ…ط³ط§",
                       "country_en":  "Austria",
                       "country_code":  "AT",
                       "lat":  48.20849,
                       "lng":  16.37208,
                       "timezone":  "Europe/Vienna",
                       "elevation":  171
                   },
                   {
                       "id":  "sydney",
                       "name_ar":  "ط³ظٹط¯ظ†ظٹ",
                       "name_en":  "Sydney",
                       "country_ar":  "ط£ط³طھط±ط§ظ„ظٹط§",
                       "country_en":  "Australia",
                       "country_code":  "AU",
                       "lat":  -33.86785,
                       "lng":  151.20732,
                       "timezone":  "Australia/Sydney",
                       "elevation":  null
                   },
                   {
                       "id":  "melbourne",
                       "name_ar":  "ظ…ظ„ط¨ظˆط±ظ†",
                       "name_en":  "Melbourne",
                       "country_ar":  "ط£ط³طھط±ط§ظ„ظٹط§",
                       "country_en":  "Australia",
                       "country_code":  "AU",
                       "lat":  -37.814,
                       "lng":  144.96332,
                       "timezone":  "Australia/Melbourne",
                       "elevation":  null
                   },
                   {
                       "id":  "baku",
                       "name_ar":  "ط¨ط§ظƒظˆ",
                       "name_en":  "Baku",
                       "country_ar":  "ط£ط°ط±ط¨ظٹط¬ط§ظ†",
                       "country_en":  "Azerbaijan",
                       "country_code":  "AZ",
                       "lat":  40.37767,
                       "lng":  49.89201,
                       "timezone":  "Asia/Baku",
                       "elevation":  null
                   },
                   {
                       "id":  "sylhet",
                       "name_ar":  "ط³ظٹظ„ظ‡طھ",
                       "name_en":  "Sylhet",
                       "country_ar":  "ط¨ظ†ط؛ظ„ط§ط¯ظٹط´",
                       "country_en":  "Bangladesh",
                       "country_code":  "BD",
                       "lat":  24.89904,
                       "lng":  91.87198,
                       "timezone":  "Asia/Dhaka",
                       "elevation":  null
                   },
                   {
                       "id":  "dhaka",
                       "name_ar":  "ط¯ظƒط§",
                       "name_en":  "Dhaka",
                       "country_ar":  "ط¨ظ†ط؛ظ„ط§ط¯ظٹط´",
                       "country_en":  "Bangladesh",
                       "country_code":  "BD",
                       "lat":  23.7104,
                       "lng":  90.40744,
                       "timezone":  "Asia/Dhaka",
                       "elevation":  null
                   },
                   {
                       "id":  "chattogram",
                       "name_ar":  "ط´ظٹطھط§ط؛ظˆظ†ط؛",
                       "name_en":  "Chattogram",
                       "country_ar":  "ط¨ظ†ط؛ظ„ط§ط¯ظٹط´",
                       "country_en":  "Bangladesh",
                       "country_code":  "BD",
                       "lat":  22.3384,
                       "lng":  91.83168,
                       "timezone":  "Asia/Dhaka",
                       "elevation":  null
                   },
                   {
                       "id":  "khulna",
                       "name_ar":  "ط®ظˆظ„ظ†ط§",
                       "name_en":  "Khulna",
                       "country_ar":  "ط¨ظ†ط؛ظ„ط§ط¯ظٹط´",
                       "country_en":  "Bangladesh",
                       "country_code":  "BD",
                       "lat":  22.80979,
                       "lng":  89.56439,
                       "timezone":  "Asia/Dhaka",
                       "elevation":  null
                   },
                   {
                       "id":  "brussels",
                       "name_ar":  "ط¨ط±ظˆظƒط³ظ„",
                       "name_en":  "Brussels",
                       "country_ar":  "ط¨ظ„ط¬ظٹظƒط§",
                       "country_en":  "Belgium",
                       "country_code":  "BE",
                       "lat":  50.85045,
                       "lng":  4.34878,
                       "timezone":  "Europe/Brussels",
                       "elevation":  null
                   },
                   {
                       "id":  "manama",
                       "name_ar":  "المنامة",
                       "name_en":  "Manama",
                       "country_ar":  "ط§ظ„ط¨ط­ط±ظٹظ†",
                       "country_en":  "Bahrain",
                       "country_code":  "BH",
                       "lat":  26.22787,
                       "lng":  50.58565,
                       "timezone":  "Asia/Bahrain",
                       "elevation":  null
                   },
                   {
                       "id":  "sao-paulo",
                       "name_ar":  "ط³ط§ظˆ ط¨ط§ظˆظ„ظˆ",
                       "name_en":  "Sao Paulo",
                       "country_ar":  "ط§ظ„ط¨ط±ط§ط²ظٹظ„",
                       "country_en":  "Brazil",
                       "country_code":  "BR",
                       "lat":  -23.5475,
                       "lng":  -46.63611,
                       "timezone":  "America/Sao_Paulo",
                       "elevation":  null
                   },
                   {
                       "id":  "montreal",
                       "name_ar":  "ظ…ظˆظ†طھط±ظٹط§ظ„",
                       "name_en":  "Montreal",
                       "country_ar":  "ظƒظ†ط¯ط§",
                       "country_en":  "Canada",
                       "country_code":  "CA",
                       "lat":  45.50884,
                       "lng":  -73.58781,
                       "timezone":  "America/Toronto",